{
  "schema_version": "acceptance-manifest/v1",
  "ticket_id": "AIDEV-158",
  "repository": "Zkrausman/pi-sampler",
  "plan_path": "docs/techPlans/AIDEV-158-implementation-plan.md",
  "plan_sha256": "82477d57fa1413d2829a2da626ef7a179078710845c6f243e34a5b042adad95f",
  "base_sha": "bc4a2446e992414c1e5d62d0635330216f2d4c8d",
  "rows": [
    {"id": "A158-T01", "title": "Repository authority capability audit", "acceptance_class": "authority", "requirement": "No repository script or workflow can mint a clean marker, force-push, merge, or transition Linear."},
    {"id": "A158-T02", "title": "Sticky merge prohibition", "acceptance_class": "authority", "requirement": "Readiness, refresh, push, and auto-merge language never overrides a prior do-not-merge instruction."},
    {"id": "A158-T03", "title": "Stable acceptance row binding", "acceptance_class": "ordinary", "requirement": "Missing, duplicate, confusable, unknown, deleted, or plan-digest-mismatched rows fail closed."},
    {"id": "A158-T04", "title": "External signed waiver binding", "acceptance_class": "waiver", "requirement": "Only a trusted, current, scoped, non-replayed operator signature can waive a row."},
    {"id": "A158-T05", "title": "AIDEV-133 requirement remains blocked", "acceptance_class": "requirement", "requirement": "The linked flat-memory rebuild requirement remains unresolved without observed benchmark evidence or a valid external waiver."},
    {"id": "A158-T06", "title": "CI benchmark cannot satisfy local scale", "acceptance_class": "benchmark-ci-regression", "requirement": "The smaller CI regression cannot satisfy the exact local 10M benchmark class."},
    {"id": "A158-T07", "title": "Baseline has no pass claim", "acceptance_class": "benchmark-local-10m", "requirement": "The first exact 10M run records a baseline only and cannot pass without separately approved thresholds."},
    {"id": "A158-T08", "title": "Approved benchmark evaluation metrics", "acceptance_class": "benchmark-local-10m", "requirement": "Later 10M repetitions validate completeness, timeout, RSS, robust slope, variance, workload, and environment bindings."},
    {"id": "A158-T09", "title": "Shared CI measurement implementation", "acceptance_class": "benchmark-ci-regression", "requirement": "CI uses the same measurement implementation with an independently smaller fixed event count."},
    {"id": "A158-T10", "title": "Bounded hostile evidence handling", "acceptance_class": "resource-bounded", "requirement": "Huge counts, malformed samples, output bombs, timeouts, partial files, duplicate keys, and deep JSON fail within fixed limits."},
    {"id": "A158-T11", "title": "Concurrent evidence consumption", "acceptance_class": "concurrency", "requirement": "Concurrent evidence or waiver consumption cannot replace a newer result or revive revoked authority."}
  ]
}
