{
  "schema_version": "acceptance-manifest/v1",
  "ticket_id": "AIDEV-182",
  "repository": "Zkrausman/pi-sampler",
  "plan_path": "docs/techPlans/AIDEV-182-implementation-plan.md",
  "plan_sha256": "41f79a64df97455110801a4e7246d0cd104f1334d895f0f05fe2e6e37a3faccd",
  "base_sha": "5c1e144b0ab8e36378050996a1c112a06d2b5a30",
  "rows": [
    {"id": "A182-T01", "title": "Canonical-skill migration", "acceptance_class": "authority", "requirement": "Canonical skill strictly requires manual handoff, deleting team wrapper, and matching docs."},
    {"id": "A182-T02", "title": "Manual Antigravity boundary", "acceptance_class": "authority", "requirement": "Manual Antigravity handoff uses Gemini as the initial lead planner; Gemini receives the exact-base planning requirements and research and produces the uncommitted implementation plan and sibling manifest. Gemini must not be represented or invoked as a Pi provider/model; implementation, review, publication, and merge authority remain separate, with no automatic lifecycle authority."},
    {"id": "A182-T03", "title": "Exact-base worktree provisioning", "acceptance_class": "authority", "requirement": "Exact-base worktree provisioning is verified and bounded by delivery-worktree.mjs."},
    {"id": "A182-T04", "title": "Deterministic validator contract", "acceptance_class": "ordinary", "requirement": "Validator ensures strict input, path, and security bounds, and performs no mutations."},
    {"id": "A182-T05", "title": "Manifest v2 contract", "acceptance_class": "ordinary", "requirement": "Implement implementation-plan-manifest/v2 with exporter and generated schema in contracts/."},
    {"id": "A182-T06", "title": "Exact schema parity", "acceptance_class": "ordinary", "requirement": "Exact runtime and generated-schema parity verification passes."},
    {"id": "A182-T07", "title": "V1 Backward compatibility", "acceptance_class": "ordinary", "requirement": "Preserve read/validation for existing v1 plans; no silent rewrites."},
    {"id": "A182-T08", "title": "Epic metadata in v2 manifest", "acceptance_class": "ordinary", "requirement": "V2 manifest carries hard dependencies, predecessor outputs, and portfolio metadata."},
    {"id": "A182-T09", "title": "Explicit staleness boundaries", "acceptance_class": "ordinary", "requirement": "Defines explicit drift triggers without claiming descendant-base campaign staleness."},
    {"id": "A182-T10", "title": "Digest and ID parity", "acceptance_class": "ordinary", "requirement": "Digest and acceptance IDs match exactly between plan and manifest over UTF-8 bytes."},
    {"id": "A182-T11", "title": "Audit corpus tests", "acceptance_class": "ordinary", "requirement": "AIDEV-132–AIDEV-140 audit corpus tests verify detections via independent classes."},
    {"id": "A182-T12", "title": "Exact negative tests", "acceptance_class": "ordinary", "requirement": "Independent tests cover JSON faults, bounds, traversal, Git refs, base-drifts, and ID mismatches."},
    {"id": "A182-T13", "title": "Review discipline", "acceptance_class": "ordinary", "requirement": "Classifies defects vs preferences, bounding revisions and adversarial paths."},
    {"id": "A182-T14", "title": "V1-to-V2 Bootstrap boundary", "acceptance_class": "ordinary", "requirement": "Ensures AIDEV-182 emits valid v1 artifacts until v2 merges."},
    {"id": "A182-T15", "title": "Rollback verification", "acceptance_class": "ordinary", "requirement": "Tests rollback restoring previous skill versions without auto-publication."},
    {"id": "A182-T16", "title": "Bounded two-stage protocol", "acceptance_class": "ordinary", "requirement": "Bounded two-stage protocol explicitly enforces Stage 1 vs Stage 2 boundaries and exact state progression."},
    {"id": "A182-T17", "title": "Trusted model selection", "acceptance_class": "ordinary", "requirement": "Trusted model/policy selection correctly defines operator-owned choices and lifecycle authority boundaries."},
    {"id": "A182-T18", "title": "Validator accuracy", "acceptance_class": "ordinary", "requirement": "Validator accurately enforces constraints against malformed inputs, missing objects, bounded resources, Windows/Linux handling, and stateless behavior."},
    {"id": "A182-T19", "title": "Ownership mapping", "acceptance_class": "ordinary", "requirement": "Evaluates ownership constraints for evidence owner, fixture owner, acceptance owner, and repository-document authority."},
    {"id": "A182-T20", "title": "Independent plan approval", "acceptance_class": "ordinary", "requirement": "Requires independent plan approval before implementation."},
    {"id": "A182-T21", "title": "Implementation slices", "acceptance_class": "ordinary", "requirement": "Validates implementation slices (1, 2, 3) merge according to explicit dependency boundaries."},
    {"id": "A182-T22", "title": "Deterministic observability", "acceptance_class": "ordinary", "requirement": "Validates deterministic bounded observability (error codes and envelope outputs without prompt/credential leakage)."},
    {"id": "A182-T23", "title": "Portfolio metadata revalidation", "acceptance_class": "ordinary", "requirement": "V2 manifest correctly parses bounded portfolio metadata and validates just-in-time staleness revalidation inputs."}
  ]
}
